[
  {
    "app": {
      "name": "Salesforce",
      "category": "CRM and Sales",
      "description": "Enterprise CRM platform for sales pipeline management, custom objects, and workflow automation."
    },
    "authentication": {
      "methods": [
        "OAuth2"
      ],
      "credential_setup": "Free tier available",
      "self_serve": true,
      "gated": false,
      "gating_reason": null
    },
    "api": {
      "type": "Both",
      "breadth": "Comprehensive",
      "write_operations": true,
      "webhooks": true
    },
    "mcp": {
      "available": true,
      "type": "Community",
      "agent_callable": true,
      "source_url": "https://github.com/modelcontextprotocol/servers"
    },
    "buildability": {
      "verdict": "Buildable",
      "primary_blocker": "Connected App configuration and OAuth scope permission sets required.",
      "effort_estimate": "High"
    },
    "evidence": {
      "urls": [
        "https://developer.salesforce.com/docs/atlas.en-us.api_rest.meta/api_rest/intro_what_is_rest_api.htm",
        "https://developer.salesforce.com/signup"
      ],
      "snippets": [
        {
          "claim": "REST and GraphQL API availability with extensive write capabilities",
          "source": "developer.salesforce.com",
          "quote": "The Salesforce REST API lets you integrate with Salesforce applications using standard HTTP methods."
        },
        {
          "claim": "Free Developer Edition accounts offer self-serve credential creation",
          "source": "developer.salesforce.com/signup",
          "quote": "Developer Edition provides a free, full-featured Salesforce environment with API access."
        }
      ],
      "confidence": "HIGH",
      "verification_status": "Verified",
      "last_checked": "2026-08-17T12:13:15.650Z"
    }
  },
  {
    "app": {
      "name": "HubSpot",
      "category": "CRM and Sales",
      "description": "Inbound CRM, sales pipeline, and customer lifecycle management software."
    },
    "authentication": {
      "methods": [
        "OAuth2",
        "API Key"
      ],
      "credential_setup": "Self-serve signup",
      "self_serve": true,
      "gated": false,
      "gating_reason": null
    },
    "api": {
      "type": "Both",
      "breadth": "Comprehensive",
      "write_operations": true,
      "webhooks": true
    },
    "mcp": {
      "available": true,
      "type": "Community",
      "agent_callable": true,
      "source_url": "https://github.com/hubspot-community"
    },
    "buildability": {
      "verdict": "Easy Win",
      "primary_blocker": null,
      "effort_estimate": "Low"
    },
    "evidence": {
      "urls": [
        "https://developers.hubspot.com/docs/api/overview",
        "https://developers.hubspot.com/docs/api/private-apps"
      ],
      "snippets": [
        {
          "claim": "Private Apps allow immediate access token generation without app marketplace approval",
          "source": "developers.hubspot.com",
          "quote": "Private apps allow you to use HubSpot's APIs to access your HubSpot account's data via access tokens."
        }
      ],
      "confidence": "HIGH",
      "verification_status": "Verified",
      "last_checked": "2026-08-17T12:13:15.650Z"
    }
  },
  {
    "app": {
      "name": "Pipedrive",
      "category": "CRM and Sales",
      "description": "Sales-focused CRM and pipeline management tool for deal-driven teams."
    },
    "authentication": {
      "methods": [
        "OAuth2",
        "API Key"
      ],
      "credential_setup": "Trial required",
      "self_serve": true,
      "gated": false,
      "gating_reason": null
    },
    "api": {
      "type": "REST",
      "breadth": "Comprehensive",
      "write_operations": true,
      "webhooks": true
    },
    "mcp": {
      "available": false,
      "type": "None",
      "agent_callable": true,
      "source_url": null
    },
    "buildability": {
      "verdict": "Easy Win",
      "primary_blocker": null,
      "effort_estimate": "Low"
    },
    "evidence": {
      "urls": [
        "https://developers.pipedrive.com/docs/api/v1",
        "https://pipedrive.readme.io/docs/how-to-find-the-api-token"
      ],
      "snippets": [
        {
          "claim": "Direct personal API token accessible in user settings for instant REST calls",
          "source": "developers.pipedrive.com",
          "quote": "Every user has their own unique personal API token that grants access to company data they can see."
        }
      ],
      "confidence": "HIGH",
      "verification_status": "Verified",
      "last_checked": "2026-08-17T12:13:15.609Z"
    }
  },
  {
    "app": {
      "name": "Attio",
      "category": "CRM and Sales",
      "description": "Modern, customizable, real-time CRM platform built for fast-growing technology companies."
    },
    "authentication": {
      "methods": [
        "Bearer/PAT",
        "OAuth2"
      ],
      "credential_setup": "Free tier available",
      "self_serve": true,
      "gated": false,
      "gating_reason": null
    },
    "api": {
      "type": "REST",
      "breadth": "Comprehensive",
      "write_operations": true,
      "webhooks": true
    },
    "mcp": {
      "available": true,
      "type": "Community",
      "agent_callable": true,
      "source_url": "https://github.com/composio/attio"
    },
    "buildability": {
      "verdict": "Easy Win",
      "primary_blocker": null,
      "effort_estimate": "Low"
    },
    "evidence": {
      "urls": [
        "https://developers.attio.com/reference",
        "https://developers.attio.com/docs/authentication"
      ],
      "snippets": [
        {
          "claim": "Self-serve API keys and OAuth 2.0 with full REST endpoints for custom objects and records",
          "source": "developers.attio.com",
          "quote": "Attio's REST API allows you to programmatically read and write CRM data, create custom attributes, and listen to webhooks."
        }
      ],
      "confidence": "HIGH",
      "verification_status": "Verified",
      "last_checked": "2026-08-17T12:13:15.609Z"
    }
  },
  {
    "app": {
      "name": "Twenty",
      "category": "CRM and Sales",
      "description": "Modern open-source CRM alternative to Salesforce with GraphQL and REST APIs."
    },
    "authentication": {
      "methods": [
        "Bearer/PAT",
        "OAuth2"
      ],
      "credential_setup": "Open Source / Local",
      "self_serve": true,
      "gated": false,
      "gating_reason": null
    },
    "api": {
      "type": "Both",
      "breadth": "Comprehensive",
      "write_operations": true,
      "webhooks": true
    },
    "mcp": {
      "available": true,
      "type": "Community",
      "agent_callable": true,
      "source_url": "https://github.com/twentyhq/twenty"
    },
    "buildability": {
      "verdict": "Easy Win",
      "primary_blocker": null,
      "effort_estimate": "Low"
    },
    "evidence": {
      "urls": [
        "https://docs.twenty.com/developers/api",
        "https://docs.twenty.com/developers/authentication"
      ],
      "snippets": [
        {
          "claim": "Open-source architecture provides instant self-serve API keys and GraphQL schema introspection",
          "source": "docs.twenty.com",
          "quote": "Twenty provides both REST and GraphQL APIs authenticated via Bearer tokens generated directly in settings."
        }
      ],
      "confidence": "HIGH",
      "verification_status": "Verified",
      "last_checked": "2026-08-17T12:13:15.650Z"
    }
  },
  {
    "app": {
      "name": "Podio",
      "category": "CRM and Sales",
      "description": "Customizable work and project management platform by Citrix used as a flexible CRM."
    },
    "authentication": {
      "methods": [
        "OAuth2",
        "API Key"
      ],
      "credential_setup": "Free tier available",
      "self_serve": true,
      "gated": false,
      "gating_reason": null
    },
    "api": {
      "type": "REST",
      "breadth": "Comprehensive",
      "write_operations": true,
      "webhooks": true
    },
    "mcp": {
      "available": false,
      "type": "None",
      "agent_callable": true,
      "source_url": null
    },
    "buildability": {
      "verdict": "Easy Win",
      "primary_blocker": null,
      "effort_estimate": "Low"
    },
    "evidence": {
      "urls": [
        "https://developers.podio.com/",
        "https://developers.podio.com/authentication"
      ],
      "snippets": [
        {
          "claim": "Self-serve API keys and OAuth 2.0 client creation in account settings",
          "source": "developers.podio.com",
          "quote": "The Podio API gives complete programmatic control over workspaces, apps, and items using standard REST endpoints."
        }
      ],
      "confidence": "HIGH",
      "verification_status": "Verified",
      "last_checked": "2026-08-17T12:13:15.609Z"
    }
  },
  {
    "app": {
      "name": "Zoho CRM",
      "category": "CRM and Sales",
      "description": "Omnichannel customer relationship management platform for multi-regional sales."
    },
    "authentication": {
      "methods": [
        "OAuth2"
      ],
      "credential_setup": "Self-serve signup",
      "self_serve": true,
      "gated": false,
      "gating_reason": null
    },
    "api": {
      "type": "REST",
      "breadth": "Comprehensive",
      "write_operations": true,
      "webhooks": true
    },
    "mcp": {
      "available": false,
      "type": "None",
      "agent_callable": true,
      "source_url": null
    },
    "buildability": {
      "verdict": "Buildable",
      "primary_blocker": "Multi-datacenter OAuth2 client configuration in Zoho API Console.",
      "effort_estimate": "Medium"
    },
    "evidence": {
      "urls": [
        "https://www.zoho.com/crm/developer/docs/api/v6/",
        "https://api-console.zoho.com/"
      ],
      "snippets": [
        {
          "claim": "Multi-datacenter OAuth2 client configuration in Zoho API Console",